{
  "$schema": "../../../schemas/content-bundle.schema.json",
  "schemaVersion": "0.1.0",
  "contentVersion": "0.1.0",
  "bundleId": "changan.renshuo",
  "locale": "zh-CN",
  "scenario": {
    "id": "scenario.changan.renshuo",
    "titleKey": "scenario.changan.renshuo.title",
    "entryEventId": "event.changan.renshuo.r01",
    "stages": [
      "stage.changan.departure",
      "stage.changan.search",
      "stage.changan.escort",
      "stage.changan.confrontation",
      "stage.changan.commitment",
      "stage.changan.equipment",
      "stage.changan.growth",
      "stage.changan.gate",
      "stage.changan.final",
      "stage.changan.aftermath"
    ],
    "historicalAnchors": [
      {
        "id": "anchor.changan.fall",
        "stage": "stage.changan.aftermath",
        "immutable": true
      }
    ]
  },
  "initialState": {
    "playerCharacterId": "character.ren_shuo",
    "abilities": {
      "martial": 2,
      "strategy": 1,
      "influence": 1
    },
    "resources": {
      "breath": 2,
      "time": 3,
      "favor": 1
    },
    "injury": 1,
    "heat": 1,
    "life": "alive",
    "freedom": "free",
    "conduct": [],
    "flags": [],
    "knowledge": [],
    "insights": {
      "breaker": 0,
      "protector": 0
    },
    "relationships": [
      {
        "characterId": "character.wei_shi",
        "attitude": 1,
        "tags": [
          "relation.comrade",
          "relation.saved_life"
        ]
      },
      {
        "characterId": "character.camp_officer",
        "attitude": -1,
        "tags": []
      },
      {
        "characterId": "character.aluo",
        "attitude": 0,
        "tags": []
      }
    ]
  },
  "characters": [
    {
      "id": "character.ren_shuo",
      "nameKey": "character.ren_shuo.name",
      "factionIds": [
        "faction.bingzhou_army"
      ],
      "tags": [
        "role.player",
        "role.scout"
      ],
      "defaultFate": "fate.active"
    },
    {
      "id": "character.wei_shi",
      "nameKey": "character.wei_shi.name",
      "factionIds": [
        "faction.bingzhou_army"
      ],
      "tags": [
        "role.swordsman",
        "role.comrade"
      ],
      "defaultFate": "fate.active"
    },
    {
      "id": "character.aluo",
      "nameKey": "character.aluo.name",
      "factionIds": [
        "faction.civilians"
      ],
      "tags": [
        "role.healer"
      ],
      "defaultFate": "fate.unmet"
    },
    {
      "id": "character.civilians",
      "nameKey": "character.civilians.name",
      "factionIds": [
        "faction.civilians"
      ],
      "tags": [
        "role.group"
      ],
      "defaultFate": "fate.unmet"
    },
    {
      "id": "character.elder_veteran",
      "nameKey": "character.elder_veteran.name",
      "factionIds": [
        "faction.bingzhou_army"
      ],
      "tags": [
        "role.retired",
        "role.instructor"
      ],
      "defaultFate": "fate.critical"
    },
    {
      "id": "character.attacker",
      "nameKey": "character.attacker.name",
      "factionIds": [
        "faction.dong_zhuo_remnant"
      ],
      "tags": [
        "role.hostile"
      ],
      "defaultFate": "fate.active"
    },
    {
      "id": "character.zhao_heng",
      "nameKey": "character.zhao_heng.name",
      "factionIds": [
        "faction.wang_yun_house"
      ],
      "tags": [
        "role.swordsman"
      ],
      "defaultFate": "fate.active"
    },
    {
      "id": "character.future_successor",
      "nameKey": "character.future_successor.name",
      "factionIds": [
        "faction.jianghu"
      ],
      "tags": [
        "role.successor"
      ],
      "defaultFate": "fate.future"
    },
    {
      "id": "character.camp_officer",
      "nameKey": "character.camp_officer.name",
      "factionIds": [
        "faction.bingzhou_army"
      ],
      "tags": [
        "role.officer"
      ],
      "defaultFate": "fate.active"
    },
    {
      "id": "character.du_jian",
      "nameKey": "character.du_jian.name",
      "factionIds": [
        "faction.wang_yun_house"
      ],
      "tags": [
        "role.swordsman"
      ],
      "defaultFate": "fate.active"
    }
  ],
  "locations": [
    {
      "id": "location.changan.bingzhou_camp",
      "nameKey": "location.changan.bingzhou_camp.name",
      "tags": [
        "environment.military"
      ]
    },
    {
      "id": "location.changan.west_market_ruins",
      "nameKey": "location.changan.west_market_ruins.name",
      "tags": [
        "environment.ruins"
      ]
    },
    {
      "id": "location.changan.military_family_lane",
      "nameKey": "location.changan.military_family_lane.name",
      "tags": [
        "environment.courtyard"
      ]
    },
    {
      "id": "location.changan.backyard",
      "nameKey": "location.changan.backyard.name",
      "tags": [
        "environment.courtyard"
      ]
    },
    {
      "id": "location.changan.near_camp_path",
      "nameKey": "location.changan.near_camp_path.name",
      "tags": [
        "environment.alley"
      ]
    },
    {
      "id": "location.changan.ruined_temple",
      "nameKey": "location.changan.ruined_temple.name",
      "tags": [
        "environment.temple"
      ]
    },
    {
      "id": "location.changan.west_gate",
      "nameKey": "location.changan.west_gate.name",
      "tags": [
        "environment.gate"
      ]
    },
    {
      "id": "location.changan.gate_hill",
      "nameKey": "location.changan.gate_hill.name",
      "tags": [
        "environment.open_ground"
      ]
    },
    {
      "id": "location.changan.aftermath",
      "nameKey": "location.changan.aftermath.name",
      "tags": [
        "environment.aftermath"
      ]
    }
  ],
  "itemDefinitions": [
    {
      "id": "item.ren_shuo.saber",
      "nameKey": "item.ren_shuo.saber.name",
      "slot": "weapon",
      "tags": [
        "item.visible"
      ],
      "allowedStates": [
        "state.intact",
        "state.damaged",
        "state.destroyed",
        "state.confiscated",
        "state.lost",
        "state.given"
      ]
    },
    {
      "id": "item.ren_shuo.damaged_armor",
      "nameKey": "item.ren_shuo.damaged_armor.name",
      "slot": "armor",
      "tags": [
        "item.visible"
      ],
      "allowedStates": [
        "state.intact",
        "state.damaged",
        "state.destroyed",
        "state.lost",
        "state.given"
      ]
    },
    {
      "id": "item.ren_shuo.full_armor",
      "nameKey": "item.ren_shuo.full_armor.name",
      "slot": "armor",
      "tags": [
        "item.visible"
      ],
      "allowedStates": [
        "state.intact",
        "state.damaged",
        "state.destroyed",
        "state.lost",
        "state.given"
      ]
    },
    {
      "id": "item.ren_shuo.common_clothes",
      "nameKey": "item.ren_shuo.common_clothes.name",
      "slot": "armor",
      "tags": [
        "item.visible"
      ],
      "allowedStates": [
        "state.intact",
        "state.given",
        "state.lost"
      ]
    },
    {
      "id": "item.ren_shuo.arrowhead",
      "nameKey": "item.ren_shuo.arrowhead.name",
      "slot": "token",
      "tags": [
        "item.visible"
      ],
      "allowedStates": [
        "state.intact",
        "state.given",
        "state.confiscated",
        "state.lost"
      ]
    },
    {
      "id": "item.ren_shuo.medicine",
      "nameKey": "item.ren_shuo.medicine.name",
      "slot": "consumable",
      "tags": [
        "item.visible"
      ],
      "allowedStates": [
        "state.intact",
        "state.used",
        "state.lost"
      ]
    },
    {
      "id": "item.ren_shuo.camp_token",
      "nameKey": "item.ren_shuo.camp_token.name",
      "slot": "token",
      "tags": [
        "item.visible"
      ],
      "allowedStates": [
        "state.intact",
        "state.given",
        "state.confiscated",
        "state.lost"
      ]
    },
    {
      "id": "item.ren_shuo.manual",
      "nameKey": "item.ren_shuo.manual.name",
      "slot": "story",
      "tags": [
        "item.visible",
        "item.manual"
      ],
      "allowedStates": [
        "state.intact",
        "state.given",
        "state.lost"
      ]
    }
  ],
  "itemInstances": [
    {
      "id": "item_instance.ren_shuo.saber",
      "definitionId": "item.ren_shuo.saber",
      "holderId": "character.ren_shuo",
      "state": "state.intact",
      "equipped": true,
      "quantity": 1
    },
    {
      "id": "item_instance.ren_shuo.damaged_armor",
      "definitionId": "item.ren_shuo.damaged_armor",
      "holderId": "character.ren_shuo",
      "state": "state.intact",
      "equipped": true,
      "quantity": 1
    },
    {
      "id": "item_instance.ren_shuo.full_armor",
      "definitionId": "item.ren_shuo.full_armor",
      "holderId": "location.changan.military_family_lane",
      "state": "state.intact",
      "equipped": false,
      "quantity": 1
    },
    {
      "id": "item_instance.ren_shuo.common_clothes",
      "definitionId": "item.ren_shuo.common_clothes",
      "holderId": "character.ren_shuo",
      "state": "state.intact",
      "equipped": false,
      "quantity": 1
    },
    {
      "id": "item_instance.ren_shuo.arrowhead",
      "definitionId": "item.ren_shuo.arrowhead",
      "holderId": "character.ren_shuo",
      "state": "state.intact",
      "equipped": true,
      "quantity": 1
    },
    {
      "id": "item_instance.ren_shuo.medicine",
      "definitionId": "item.ren_shuo.medicine",
      "holderId": "character.ren_shuo",
      "state": "state.intact",
      "equipped": false,
      "quantity": 1
    },
    {
      "id": "item_instance.ren_shuo.camp_token",
      "definitionId": "item.ren_shuo.camp_token",
      "holderId": "character.ren_shuo",
      "state": "state.intact",
      "equipped": false,
      "quantity": 1
    },
    {
      "id": "item_instance.ren_shuo.manual",
      "definitionId": "item.ren_shuo.manual",
      "holderId": "location.changan.ruined_temple",
      "state": "state.intact",